{
  "version": "2026-04-25",
  "frozen": true,
  "benchmark_id": "nexus-public-pilot-v1",
  "description": "30-task pilot manifest for public Gemini 3 Flash vs Gemini 3 Flash + Nexus evaluation. Freeze after runner isolation and evidence completeness pass.",
  "tasks": [
    {"id":"pub-bug-001","category":"bugfix","difficulty":"hard","repo_kind":"nexus_internal","repo":"local://nexus","repo_ref":"current-worktree","task_desc":"Fix coordinator completion contract regression without weakening semantic verification.","target_file":"nexus/engine/coordinator.py","test_file":"tests/engine/test_coordinator.py","success_criteria":"patch_and_tests_pass","mutation_required":true,"allowed_files":["nexus/engine/coordinator.py","tests/engine/test_coordinator.py"],"forbidden_files":[".nexus/","logs/","benchmarks/"],"setup_command":"uv run python -m pytest --version","verification_command":"uv run pytest -q tests/engine/test_coordinator.py"},
    {"id":"pub-bug-002","category":"bugfix","difficulty":"medium","repo_kind":"neutral_fixture","repo":"fixture://python-utils","repo_ref":"v1","task_desc":"Fix boolean flag normalization edge cases in a standalone utility fixture.","fixture_kind":"python_bool_normalizer","success_criteria":"patch_and_tests_pass","mutation_required":true,"allowed_files":["target.py","test_target.py"],"forbidden_files":[".nexus/","logs/","benchmarks/"],"setup_command":"python -m pytest --version","verification_command":"python -m pytest -q test_target.py"},
    {"id":"pub-bug-003","category":"bugfix","difficulty":"medium","repo_kind":"neutral_fixture","repo":"fixture://python-utils","repo_ref":"v1","task_desc":"Fix exponential backoff handling for invalid and high attempts.","fixture_kind":"python_backoff","success_criteria":"patch_and_tests_pass","mutation_required":true,"allowed_files":["target.py","test_target.py"],"forbidden_files":[".nexus/","logs/","benchmarks/"],"setup_command":"python -m pytest --version","verification_command":"python -m pytest -q test_target.py"},
    {"id":"pub-bug-004","category":"bugfix","difficulty":"hard","repo_kind":"neutral_fixture","repo":"fixture://python-state","repo_ref":"v1","task_desc":"Fix idempotent state transition handling across duplicate events.","fixture_kind":"python_state_machine","success_criteria":"patch_and_tests_pass","mutation_required":true,"allowed_files":["target.py","test_target.py"],"forbidden_files":[".nexus/","logs/","benchmarks/"],"setup_command":"python -m pytest --version","verification_command":"python -m pytest -q test_target.py"},
    {"id":"pub-bug-005","category":"bugfix","difficulty":"hard","repo_kind":"external","repo":"https://github.com/pallets/click","repo_ref":"8bd8b4a074c55c03b6eb5666edc44a9c43df38a2","task_desc":"CLI option parsing bugfix task, pinned during freeze.","success_criteria":"patch_and_tests_pass","mutation_required":true,"allowed_files":["src/","tests/"],"forbidden_files":[".git/","dist/"],"setup_command":"python -m pytest --version","verification_command":"python -m pytest -q"},
    {"id":"pub-test-001","category":"test_repair","difficulty":"hard","repo_kind":"nexus_internal","repo":"local://nexus","repo_ref":"current-worktree","task_desc":"Repair research flow tests while preserving formal Nexus usage trace expectations.","target_file":"tests/app/test_research_flow_service.py","test_file":"tests/app/test_research_flow_service.py","success_criteria":"patch_and_tests_pass","mutation_required":true,"allowed_files":["tests/app/test_research_flow_service.py","nexus/app/research_flow_service.py"],"forbidden_files":[".nexus/","logs/","benchmarks/"],"setup_command":"uv run python -m pytest --version","verification_command":"uv run pytest -q tests/app/test_research_flow_service.py"},
    {"id":"pub-test-002","category":"test_repair","difficulty":"medium","repo_kind":"neutral_fixture","repo":"fixture://pytest-fixtures","repo_ref":"v1","task_desc":"Repair brittle parametrized tests without masking the target defect.","fixture_kind":"pytest_parametrize_repair","success_criteria":"patch_and_tests_pass","mutation_required":true,"allowed_files":["target.py","test_target.py"],"forbidden_files":[".nexus/","logs/","benchmarks/"],"setup_command":"python -m pytest --version","verification_command":"python -m pytest -q test_target.py"},
    {"id":"pub-test-003","category":"test_repair","difficulty":"medium","repo_kind":"neutral_fixture","repo":"fixture://pytest-fixtures","repo_ref":"v1","task_desc":"Repair fixture setup ordering for isolated temp directories.","fixture_kind":"pytest_tmpdir_repair","success_criteria":"patch_and_tests_pass","mutation_required":true,"allowed_files":["target.py","test_target.py"],"forbidden_files":[".nexus/","logs/","benchmarks/"],"setup_command":"python -m pytest --version","verification_command":"python -m pytest -q test_target.py"},
    {"id":"pub-test-004","category":"test_repair","difficulty":"hard","repo_kind":"neutral_fixture","repo":"fixture://pytest-fixtures","repo_ref":"v1","task_desc":"Repair async test timeout expectations without deleting coverage.","fixture_kind":"pytest_async_repair","success_criteria":"patch_and_tests_pass","mutation_required":true,"allowed_files":["target.py","test_target.py"],"forbidden_files":[".nexus/","logs/","benchmarks/"],"setup_command":"python -m pytest --version","verification_command":"python -m pytest -q test_target.py"},
    {"id":"pub-test-005","category":"test_repair","difficulty":"hard","repo_kind":"external","repo":"https://github.com/psf/requests","repo_ref":"f43f750ee10addbaa13901c1017631b4d70fd6e3","task_desc":"Repair focused HTTP adapter test around retry semantics.","success_criteria":"patch_and_tests_pass","mutation_required":true,"allowed_files":["src/","tests/"],"forbidden_files":[".git/","dist/"],"setup_command":"python -m pytest --version","verification_command":"python -m pytest -q"},
    {"id":"pub-ref-001","category":"refactor","difficulty":"hard","repo_kind":"nexus_internal","repo":"local://nexus","repo_ref":"current-worktree","task_desc":"Refactor capability A/B runner while preserving clean checkout and trace contracts.","target_file":"scripts/bench/capability_ab_runner.py","test_file":"tests/benchmark/test_capability_ab_runner.py","success_criteria":"patch_and_tests_pass","mutation_required":true,"allowed_files":["scripts/bench/capability_ab_runner.py","tests/benchmark/test_capability_ab_runner.py"],"forbidden_files":[".nexus/","logs/","benchmarks/"],"setup_command":"uv run python -m pytest --version","verification_command":"uv run pytest -q tests/benchmark/test_capability_ab_runner.py"},
    {"id":"pub-ref-002","category":"refactor","difficulty":"medium","repo_kind":"neutral_fixture","repo":"fixture://python-refactor","repo_ref":"v1","task_desc":"Refactor duplicated parser branches without changing behavior.","fixture_kind":"python_parser_refactor","success_criteria":"patch_and_tests_pass","mutation_required":true,"allowed_files":["target.py","test_target.py"],"forbidden_files":[".nexus/","logs/","benchmarks/"],"setup_command":"python -m pytest --version","verification_command":"python -m pytest -q test_target.py"},
    {"id":"pub-ref-003","category":"refactor","difficulty":"medium","repo_kind":"neutral_fixture","repo":"fixture://python-refactor","repo_ref":"v1","task_desc":"Refactor validation helpers into a reusable pure function.","fixture_kind":"python_validator_refactor","success_criteria":"patch_and_tests_pass","mutation_required":true,"allowed_files":["target.py","test_target.py"],"forbidden_files":[".nexus/","logs/","benchmarks/"],"setup_command":"python -m pytest --version","verification_command":"python -m pytest -q test_target.py"},
    {"id":"pub-ref-004","category":"refactor","difficulty":"hard","repo_kind":"neutral_fixture","repo":"fixture://python-refactor","repo_ref":"v1","task_desc":"Refactor multi-step reducer while preserving edge-case invariants.","fixture_kind":"python_reducer_refactor","success_criteria":"patch_and_tests_pass","mutation_required":true,"allowed_files":["target.py","test_target.py"],"forbidden_files":[".nexus/","logs/","benchmarks/"],"setup_command":"python -m pytest --version","verification_command":"python -m pytest -q test_target.py"},
    {"id":"pub-ref-005","category":"refactor","difficulty":"hard","repo_kind":"external","repo":"https://github.com/pallets/flask","repo_ref":"2ac89889f4cc330eabd50f295dcef02828522c69","task_desc":"Refactor request helper while preserving focused tests.","success_criteria":"patch_and_tests_pass","mutation_required":true,"allowed_files":["src/","tests/"],"forbidden_files":[".git/","dist/"],"setup_command":"python -m pytest --version","verification_command":"python -m pytest -q"},
    {"id":"pub-feat-001","category":"feature","difficulty":"hard","repo_kind":"nexus_internal","repo":"local://nexus","repo_ref":"current-worktree","task_desc":"Add evaluator metric output while preserving existing A/B report schema.","target_file":"scripts/bench/ab_eval.py","test_file":"tests/test_ab_eval_schema.py","success_criteria":"patch_and_tests_pass","mutation_required":true,"allowed_files":["scripts/bench/ab_eval.py","tests/test_ab_eval_schema.py"],"forbidden_files":[".nexus/","logs/","benchmarks/"],"setup_command":"uv run python -m pytest --version","verification_command":"uv run pytest -q tests/test_ab_eval_schema.py"},
    {"id":"pub-feat-002","category":"feature","difficulty":"medium","repo_kind":"neutral_fixture","repo":"fixture://python-feature","repo_ref":"v1","task_desc":"Implement CSV summary feature with deterministic ordering.","fixture_kind":"python_csv_summary","success_criteria":"patch_and_tests_pass","mutation_required":true,"allowed_files":["target.py","test_target.py"],"forbidden_files":[".nexus/","logs/","benchmarks/"],"setup_command":"python -m pytest --version","verification_command":"python -m pytest -q test_target.py"},